{
  "contract_id": "analytics-ui-observability-ecosystem-hardening",
  "contract_version": "0.1.0",
  "governed_by_rfc": "RFC-0108",
  "lifecycle_status": "slice-17-ecosystem-hardening-certified",
  "source_contracts": [
    "analytics-ui-observability-contract",
    "analytics-ui-observability-ecosystem-completion",
    "analytics-ui-observability-ecosystem-proof"
  ],
  "review_scope": [
    {
      "area": "supported journey proof",
      "status": "passed",
      "evidence": "Slice 16 proof covers the implemented portfolio, performance, risk, advisory, management-action, report/evidence, and AI-backed journeys for PB_SG_GLOBAL_BAL_001 with screenshot, API, dashboard, alert, protected diagnostics, and no-sensitive assertions."
    },
    {
      "area": "repository gap matrix",
      "status": "passed",
      "evidence": "Every participating Lotus repository has an explicit gap-matrix row, reviewed feature keys, CI/proof posture, wiki-source decision, runbook requirement, and no-open-P0/P1 posture."
    },
    {
      "area": "api and swagger certification",
      "status": "passed",
      "evidence": "The only ecosystem proof OpenAPI-required path is Gateway protected diagnostics, which Slice 16 validates against Gateway OpenAPI. Metrics endpoints remain outside OpenAPI by policy."
    },
    {
      "area": "dashboard and alerts",
      "status": "passed",
      "evidence": "Slice 15 and Slice 16 reconcile dashboard and alert references to implemented metric families only, including Workbench, Gateway, backend freshness, and AI supportability metrics."
    },
    {
      "area": "residual planned scope",
      "status": "planned_residual",
      "evidence": "Gateway source supportability reconciliation is now implemented for performance/risk analytics through Gateway PR #166, core portfolio readiness through Gateway PR #167, manage action-register reads through Gateway PR #168, report evidence-surface batch reads through Gateway PR #169, and AI advisor-brief reads through Gateway PR #170. Workbench source_supportability reconciliation for supported performance/risk reads is implemented through Workbench PR #118, portfolio readiness supportability consumption is implemented through Workbench PR #120, manage action-register supportability consumption is implemented through Workbench PR #121, report evidence-surface supportability consumption for report-batch operator reads is implemented through Workbench PR #122, AI advisor-brief supportability consumption is implemented through Workbench PR #123, and clean governed canonical runtime proof passed after Workbench PR #119 and lotus-core PR #328. Full Workbench freshness/degraded promotion and full all-supported-surface promotion remain planned until complete RFC-0079 risk/evidence and all-supported-surface coverage are separately implemented and certified."
    }
  ],
  "repository_reviews": [
    {
      "repository": "lotus-platform",
      "review_status": "certified_current_scope",
      "feature_keys_reviewed": [
        "platform.analytics.observability.ecosystem_completion_contract",
        "platform.analytics.observability.scaffold_ci_enforcement",
        "platform.analytics.observability.ecosystem_dashboards_alerts",
        "platform.analytics.observability.ecosystem_implementation_proof",
        "platform.analytics.observability.ecosystem_hardening_certification",
        "platform.analytics.observability.ecosystem_final_closure"
      ],
      "ci_evidence": "Slice 17 platform validators and unit tests are required before PR; GitHub Feature Lane and PR Merge Gate remain required before merge.",
      "api_certification_posture": "certified",
      "no_open_p0_p1": true
    },
    {
      "repository": "lotus-workbench",
      "review_status": "planned_residual",
      "feature_keys_reviewed": [
        "workbench.analytics.observability.contract_vocabulary",
        "workbench.analytics.observability.correlation_trace",
        "workbench.analytics.observability.panel_state_metrics",
        "workbench.analytics.observability.attention_events",
        "workbench.analytics.observability.canonical_proof",
        "workbench.analytics.observability.freshness_degraded_state",
        "workbench.analytics.observability.all_supported_surfaces"
      ],
      "ci_evidence": "Current implemented Workbench scope is protected by prior repo-native proof, Slice 16 canonical evidence, PR #118 source_supportability reconciliation proof, and clean governed canonical runtime proof from Workbench PR #119 plus lotus-core PR #328; freshness/degraded and all-supported-surface promotion remain planned until full RFC-0079 risk/evidence and complete all-supported-surface coverage are implemented.",
      "api_certification_posture": "planned_residual",
      "no_open_p0_p1": true
    },
    {
      "repository": "lotus-gateway",
      "review_status": "certified_current_scope",
      "feature_keys_reviewed": [
        "gateway.analytics.observability.contract_vocabulary",
        "gateway.analytics.observability.correlation_trace",
        "gateway.analytics.observability.structured_fanout_logs",
        "gateway.analytics.observability.fanout_metrics",
        "gateway.analytics.observability.protected_diagnostics",
        "gateway.analytics.observability.all_ui_fanout_paths"
      ],
      "ci_evidence": "Gateway fan-out, protected diagnostics, audit, and OpenAPI proof are implementation-backed by prior merged Gateway PRs and Slice 16 proof reconciliation.",
      "api_certification_posture": "certified",
      "no_open_p0_p1": true
    },
    {
      "repository": "lotus-core",
      "review_status": "planned_residual",
      "feature_keys_reviewed": ["core.observability.portfolio_supportability"],
      "ci_evidence": "Portfolio supportability is implementation-backed in lotus-core, consumed through lotus-gateway PR #167 for portfolio readiness, and consumed by lotus-workbench PR #120 for supported detailed portfolio reads and no-sensitive readiness metrics.",
      "api_certification_posture": "planned_residual",
      "no_open_p0_p1": true
    },
    {
      "repository": "lotus-performance",
      "review_status": "certified_current_scope",
      "feature_keys_reviewed": [
        "analytics.backend.observability.freshness_supportability",
        "performance.observability.calculation_supportability"
      ],
      "ci_evidence": "TWR, MWR, contribution, and attribution calculation supportability are implementation-backed in lotus-performance through PR #138, consumed through lotus-gateway PR #166, consumed by lotus-workbench PR #118 for supported reads, the RFC-0108 lotus_analytics_freshness_bucket_total companion metric is implementation-backed through PR #139, and capability publication is hardened across completed performance supportability surfaces through PR #140.",
      "api_certification_posture": "planned_residual",
      "no_open_p0_p1": true
    },
    {
      "repository": "lotus-risk",
      "review_status": "certified_current_scope",
      "feature_keys_reviewed": [
        "analytics.backend.observability.freshness_supportability",
        "risk.observability.calculation_supportability"
      ],
      "ci_evidence": "Risk/calculate, drawdown, rolling metrics, historical attribution, and concentration supportability are implementation-backed in lotus-risk through PR #107, consumed through lotus-gateway PR #166, consumed by lotus-workbench PR #118 for supported reads, and the RFC-0108 lotus_analytics_freshness_bucket_total companion metric is implementation-backed through PR #108.",
      "api_certification_posture": "planned_residual",
      "no_open_p0_p1": true
    },
    {
      "repository": "lotus-advise",
      "review_status": "planned_residual",
      "feature_keys_reviewed": ["advise.observability.advisory_supportability"],
      "ci_evidence": "Advisory supportability is implementation-backed; Gateway and Workbench advisory reconciliation remain planned.",
      "api_certification_posture": "planned_residual",
      "no_open_p0_p1": true
    },
    {
      "repository": "lotus-manage",
      "review_status": "planned_residual",
      "feature_keys_reviewed": ["manage.observability.action_register_supportability"],
      "ci_evidence": "Action-register supportability is implementation-backed in lotus-manage, consumed through lotus-gateway PR #168 for portfolio workspace rebalance supportability, and consumed by lotus-workbench PR #121 for portfolio operational support copy plus no-sensitive nested supportability metrics.",
      "api_certification_posture": "planned_residual",
      "no_open_p0_p1": true
    },
    {
      "repository": "lotus-report",
      "review_status": "planned_residual",
      "feature_keys_reviewed": ["report.observability.evidence_surface_supportability"],
      "ci_evidence": "Evidence-surface supportability is implementation-backed in lotus-report, consumed through lotus-gateway PR #169 for report-batch create/status/run-once supportability, and consumed by lotus-workbench PR #122 for bounded report-batch supportability metrics without sensitive labels.",
      "api_certification_posture": "planned_residual",
      "no_open_p0_p1": true
    },
    {
      "repository": "lotus-render",
      "review_status": "planned_residual",
      "feature_keys_reviewed": ["render.observability.render_supportability"],
      "ci_evidence": "Render supportability is implementation-backed; report/evidence reconciliation remains planned.",
      "api_certification_posture": "planned_residual",
      "no_open_p0_p1": true
    },
    {
      "repository": "lotus-archive",
      "review_status": "planned_residual",
      "feature_keys_reviewed": ["archive.observability.archive_supportability"],